username_enc,mood,message_enc,api_key_enc,ciphertext
WNWAWNDB,3,WKWPWMWMWHUMUGWTDRUGWAWNWTWPUGWRDBUGWNWAWNDB,WDDBWFPHDKWKIWWHDIINBBBGWUBWBBWFBUIPWWPIPPITWKPKPDIDWIDRWUBBIWPR ITBWWWIMIDWBDBIWWRWWWYWUIWDPDUPPDYDBIMPBWAPDIMWN,KJC EATBIVPQF JDGJ SAQXI JGYIT JDI PKVCJ CJIH NS VIGUDKTW AQJ GTB KTJVABQUKTW SAQVCIFP GTGC KM DIVI JA FKCJIT GTB CQHHAVJ SAQ EKJDAQJ RQBWMITJ HFIGCI YTAE JDGJ SAQVI KT G CGPI CHGUI JA ILHVICC SAQV JDAQWDJC GTB PIIFKTWC GC EI NIWKT JDKC UATXIVCGJKAT K EGTJ SAQ JA JGYI G BIIH NVIGJD GTB GFFAE SAQVCIFP JA CIJJFI KTJA JDI HVICITJ MAMITJ KJC AYGS JA PIIF AXIVEDIFMIB GTB KJC TAVMGF PAV SAQV MAAB JA NI FAE EDIT SAQVI CJVQWWFKTW K ITUAQVGWI SAQ JA NI YKTB JA SAQVCIFP GTB GUYTAEFIBWI JDGJ KJ JGYIC UAQVGWI JA CIIY DIFH UGT SAQ JIFF MI G FKJJFI NKJ GNAQJ EDGJC NIIT AT SAQV MKTB FGJIFS GTB EDGJ NVKTWC SAQ JA JDKC CICCKAT JABGS
YVYVYCYFYM,5,YUYNYMYMYTGMGKYXJFGKYIYVYXYNGKYFJRGKYVYVYCYFYM,YJJRYBNTJUYUCYYTJCCVRRRKYGRYRRYBRGCNYYNCNNCXYUNUNJCJYCJFYGRRCYNF CXRYYYCMCJYRJRCYYFYYYQYGCYJNJGNNJQJRCMNRYINJCMYV,KKRUB ULA SIXRCPNWB LJKL OIWHC LKQCX LJC NUPAL ALCT VO PCKGJUXY IWL KXR UXLPIRWGUXY OIWPACBN UM JCPC LI BUALCX KXR AWTTIPL OIW UX KXO SKO U GKX ULA GIMTBCLCBO XIPMKB LI NCCB WXGCPLKUX IP KXDUIWA KVIWL ALKPLUXY LJCPKTO VWL TBCKAC QXIS LJKL OIWPC UX K AKNC KXR XIXFWRYMCXLKB ATKGC KA SC VCYUX IWP SIPQ LIYCLJCP U CXGIWPKYC OIW LI VC QUXR LI OIWPACBN KXR KGQXISBCRYC LJKL ULA IQKO LI XIL JKHC KBB LJC KXASCPA LKQC K RCCT VPCKLJ KXR KBBIS OIWPACBN LI ACLLBC UXLI LJUA MIMCXL BCLLUXY YI IN KXO CDTCGLKLUIXA IP SIPPUCA UM JCPC LI YWURC OIW LJPIWYJ LJUA TPIGCAA KXR LIYCLJCP SC GKX CDTBIPC SJKLA VCCX IX OIWP MUXR KXR SIPQ LISKPRA GPCKLUXY K MIPC NWBNUBBUXY BUNC NIP OIW GKX OIW LCBB MC K VUL MIPC KVIWL SJKL VPUXYA OIW JCPC LIRKO KKRUB
PLPSAFAFAI,7,AEALAMAMAFSMSOABPTSOAQADABALSOATPHSOPLPSAFAFAI,APPHAXLFPEAEWAAFPWWDHHHOASHAHHAXHSWLAALWLLWBAELELPWPAWPTASHHWALT WBHAAAWMWPAHPHWAATAAAIASWAPLPSLLPIPHWMLHAQLPWMAD,PWXXQ CJQQT ENY BESW NQ MWWN KQC EM AXOH KQCRW NOIWB NPW LEJYN YNWF EB JWOSPEBA QCN LQJ YCFFQJN EN NOIWY O XQN QL SQCJOAW NQ OSIBQGXWHAW NPON GW BWWH PWXF OBH E GOBN KQC NQ IBQG NPON KQCJW EB O YOLW OBH BQBTCHAMWBNOX YFOSW PWJW OY GW DWAEB QCJ SQBRWJYONEQB E GOBN NQ OSIBQGXWHAW NPON KQCJW LWWXEBA O  QCN QL  EB NWJMY QL KQCJ MQQH GPESP EY O AQQH YNOJNEBA FQEBN ENY SXWOJ NPON KQCJW LWWXEBA YQMW XWRWX QL HEYSQMLQJN QJ HEYNJWYY DCN ENY OXYQ SXWOJ NPON KQCJW BQN LWWXEBA QRWJGPWXMWH EH XEIW NQ YNOJN DK WVFXQJEBA GPON DJEBAY KQC PWJW NQHOK OBH GPONY DWWB QB KQCJ MEBH XONWXK SOB KQC NWXX MW O DEN MQJW ODQCN GPONY DWWB AQEBA QB OBH PQG KQCRW DWWB LWWXEBA
QRQGQPQC,10,QGQVQMQMQXKMKUQHLBKUQCQPQHQVKUQBLFKUQRQGQPQC,QLLFQRVXLGQGAQQXLAAPFFFUQKFQFFQRFKAVQQVAVVAHQGVGVLALQALBQKFFAQVB AHFQQQAMALQFLFAQQBQQQWQKAQLVLKVVLWLFAMVFQCVLAMQP,OARKCMA WLUH GDI QNAUD DC KCHHAKD OGDL ECY DCFUE G KUH IAHIA DLUD ECYNA VAARGHQ SYGDA CTANOLARMAF UHF DLUDI KCMXRADARE YHFANIDUHFUPRA GDI CWUE DC VAAR RGWA ECYNA UD U  CYD CV  GH DANMI CV AMCDGCHUR GHDAHIGDE  GDI U IGQH DLUD ECYNA VAARGHQ FAAXRE UHF DLUDI U IDNAHQDL ICMADGMAI OLAH OANA VAARGHQ DLGI OUE GD KUH PA LARXVYR DC DUWA U IDAX PUKW UHF UKWHCORAFQA DLUD DLAIA AMCDGCHI UNA DAMXCNUNE UHF DLUD ECYTA HUTGQUDAF FGVVGKYRD DGMAI PAVCNA G AHKCYNUQA ECY DC DUWA U VAO FAAX PNAUDLI UHF URRCO ECYNIARV DC VAAR OLUDATAN UNGIAI OGDLCYD BYFQMAHD NAMAMPAN DLUD ECYNA HCD URCHA GH DLGI VAARGHQ UHF DLUD GM LANA DC IYXXCND ECY GH AJXRCNGHQ UHF YHFANIDUHFGHQ GD PE UKWHCORAFQGHQ UHF UKKAXDGHQ ECYN AMCDGCHI ECY KUH PAQGH DC VGHF U IAHIA CV KURM UHF KRUNGDE UHF OCNW DCOUNFI U MCNA PURUHKAF XRUKA
DUWNDBWKWRWI,3,WKWPWMWMWHUMUGWTDRUGWAWNWTWPUGWRDBUGDUWNDBWKWRWI,WDDBWFPHDKWKIWWHDIINBBBGWUBWBBWFBUIPWWPIPPITWKPKPDIDWIDRWUBBIWPR ITBWWWIMIDWBDBIWWRWWWYWUIWDPDUPPDYDBIMPBWAPDIMWN,DIFFA VGCDKB KJC WVIGJ JDGJ SAQXI JGYIT JDI PKVCJ CJIH NS VIGUDKTW AQJ GTB KTJVABQUKTW SAQVCIFP K EGTJ SAQ JA YTAE JDGJ SAQVI KT G CGPI GTB TATRQBWMITJGF CHGUI DIVI GTB IXIVSJDKTW EI BKCUQCC EKFF VIMGKT UATPKBITJKGF GC SAQVI PIIFKTW G NKJ BAET JABGS KB FKYI JA ITUAQVGWI SAQ JA JGYI G PIE BIIH NVIGJDC GTB JVS JA WVAQTB SAQVCIFP KT JDI HVICITJ MAMITJ TAJKUI JDI CITCGJKAT AP SAQV PIIJ JAQUDKTW JDI WVAQTB JDI CAQTBC GVAQTB SAQ GTB JDI CITCGJKAT AP JDI GKV AT SAQV CYKT JDKC UGT DIFH UGFM SAQV MKTB GTB NABS VIMIMNIV KJC AYGS JA PIIF AXIVEDIFMIB GTB EIFF EAVY JAWIJDIV JA ILHFAVI EDGJC UGQCKTW JDICI PIIFKTWC FIJC JGYI KJ ATI CJIH GJ G JKMI GTB KFF NI DIVI JA CQHHAVJ SAQ JDVAQWDAQJ AQV CICCKAT
