ciphertext_num,mood,key_a,key_b,username_encrypted,message_encrypted,response_decrypted
1,3,7,6,WNWAWNDB,WKWPWMWMWHUMUGWTDRUGWAWNWTWPUGWRDBUGWNWAWNDB...,ITS WONDERFUL THAT YOUVE TAKEN THE FIRST STEP BY REACHING OUT AND INTRODUCING YOURSELF ANAS IM HERE ...
2,5,11,10,YVYVYCYFYM,YUYNYMYMYTGMGKYXJFGKYIYVYXYNGKYFJRGKYVYVYCYFYM...,AADIL ITS WONDERFUL THAT YOUVE TAKEN THE FIRST STEP BY REACHING OUT AND INTRODUCING YOURSELF IM HERE...
3,7,15,14,PLPSAFAFAI,AEALAMAMAFSMSOABPTSOAQADABALSOATPHSOPLPSAFAFAI...,HELLO UROOJ ITS NICE TO MEET YOU IM GLAD YOUVE TAKEN THE FIRST STEP IN REACHING OUT FOR SUPPORT IT T...
4,10,21,20,QRQGQPQC,QGQVQMQMQXKMKUQHLBKUQCQPQHQVKUQBLFKUQRQGQPQC...,WELCOME KHAN ITS GREAT TO CONNECT WITH YOU TODAY I CAN SENSE THAT YOURE FEELING QUITE OVERWHELMED AN...
5,3,7,6,DUWNDBWKWRWI,WKWPWMWMWHUMUGWTDRUGWAWNWTWPUGWRDBUGDUWNDBWKWRWI...,HELLO RASHID ITS GREAT THAT YOUVE TAKEN THE FIRST STEP BY REACHING OUT AND INTRODUCING YOURSELF I WA...
